{
  "$schema": "./schema.json",
  "version": "1.0.0",
  "updated": "2026-10-16",
  "sections": [
    { "id": "design", "title": "Design Skills", "tagline": "Kill the AI slop", "blurb": "The default output looks like every other AI-generated page: same fonts, same purple gradient, same card layout. These make Claude pick a direction first." },
    { "id": "theming", "title": "Site-Wide Theming & Design Tokens", "tagline": "Make everything match", "blurb": "Design skills teach Claude to think about aesthetics. These produce the config: CSS variables, Tailwind @theme blocks, dark-mode tokens, so the whole site stays consistent without re-explaining the brand." },
    { "id": "motion", "title": "Animation & Motion", "tagline": "GSAP, Motion, scroll effects", "blurb": "Library knowledge for actually implementing motion: GSAP timelines, Motion variants, scroll-triggered effects, and motion audits." },
    { "id": "ux", "title": "UI/UX Intelligence", "tagline": "Patterns, a11y, research", "blurb": "Design thinking, UX research, growth and accessibility patterns." },
    { "id": "design-to-code", "title": "Design-to-Code Pipeline", "tagline": "Figma pipeline", "blurb": "Figma to tokens to components to code, and back." },
    { "id": "testing", "title": "Testing & Browser Automation", "tagline": "Give Claude eyes", "blurb": "Claude cannot see the UI by default. These give it a browser, DevTools and a component library to check against." },
    { "id": "docs", "title": "Docs & Context", "tagline": "Stop hallucinating APIs", "blurb": "Training data is stale. These fetch current, version-specific documentation." },
    { "id": "frameworks", "title": "Framework Skills", "tagline": "React, Tailwind, Three.js, D3", "blurb": "Specialised knowledge for specific frontend tech, plus the polish pipeline." },
    { "id": "deploy", "title": "Deploy & Preview", "tagline": "Ship it", "blurb": "Preview deployments and zero-config hosting from inside the session." }
  ],
  "tools": [
    {
      "id": "frontend-design",
      "name": "Frontend Design (Official)",
      "section": "design",
      "kind": "plugin",
      "author": "Anthropic",
      "summary": "Anthropic's own skill: Claude picks an actual aesthetic direction before writing code instead of defaulting to Inter, a purple gradient and rounded cards. Install this first; everything else assumes it.",
      "install": ["claude plugin install frontend-design@claude-plugins-official"],
      "requires": [],
      "source": "https://github.com/anthropics/claude-code/tree/main/plugins/frontend-design",
      "docs": "https://platform.claude.com/cookbook/coding-prompting-for-frontend-aesthetics",
      "stars": "Official",
      "tags": ["aesthetic", "direction", "anti-slop", "typography", "color-system", "auto-activates"],
      "notes": "Requires real typography pairing, blocks generic component patterns and cookie-cutter layouts, enforces CSS variables and cohesive color systems. Lives in the built-in claude-plugins-official marketplace, so no marketplace add is needed."
    },
    {
      "id": "ui-ux-pro-max",
      "name": "UI/UX Pro Max",
      "section": "design",
      "kind": "plugin",
      "author": "nextlevelbuilder",
      "summary": "240+ styles, 127 font pairings, 99 UX guidelines. Say \"fintech dashboard\" and it picks a design system that fits fintech; the v2 reasoning engine does the style matching.",
      "install": [
        "claude plugin marketplace add nextlevelbuilder/ui-ux-pro-max-skill",
        "claude plugin install ui-ux-pro-max@ui-ux-pro-max-skill"
      ],
      "requires": [],
      "source": "https://github.com/nextlevelbuilder/ui-ux-pro-max-skill",
      "docs": null,
      "stars": "136k",
      "tags": ["style-matching", "font-pairing", "design-system", "multi-agent"],
      "notes": "Also installable through its CLI: `npm install -g ui-ux-pro-max-cli && uipro init --ai claude`. An older CLI package with a similar name is stale; use only ui-ux-pro-max-cli. Works with Cursor, Windsurf, Codex and a dozen other agents."
    },
    {
      "id": "taste-skill",
      "name": "Taste Skill",
      "section": "design",
      "kind": "plugin",
      "author": "Leonxlnx",
      "summary": "Tunable knobs for how wild Claude gets: design variance (safe to experimental), motion intensity (subtle to cinematic), visual density (spacious to compact).",
      "install": [
        "claude plugin marketplace add Leonxlnx/taste-skill",
        "claude plugin install taste-skill@taste-skill"
      ],
      "requires": ["Node 22+", "a Chromium browser for the default skill"],
      "source": "https://github.com/Leonxlnx/taste-skill",
      "docs": null,
      "stars": "97k",
      "tags": ["variance", "knobs", "redesign", "image-to-code", "brutalist", "minimalist"],
      "notes": "Bundles several skills: design-taste-frontend (default), redesign-existing-projects, image-to-code, high-end-visual-design, minimalist-ui, industrial-brutalist-ui, brandkit. Alternative: `npx skills add https://github.com/Leonxlnx/taste-skill`."
    },
    {
      "id": "frontend-design-pro",
      "name": "Frontend Design Pro Demo",
      "section": "design",
      "kind": "plugin",
      "author": "ClaudeKit",
      "summary": "Eleven named aesthetics (Swiss Minimalism, Glassmorphism, Brutalism, Dark OLED Luxury, Organic Biomorphic, …) with working HTML/CSS demos and the master prompts that generated them. Say \"use the Dark OLED Luxury style\" and Claude knows what you mean.",
      "install": [
        "claude plugin marketplace add claudekit/frontend-design-pro-demo",
        "claude plugin install frontend-design-pro@frontend-design-pro"
      ],
      "requires": [],
      "source": "https://github.com/claudekit/frontend-design-pro-demo",
      "docs": "https://claudekit.cc",
      "stars": "278",
      "tags": ["presets", "aesthetics", "reference", "demos"],
      "notes": "Last updated late 2025; the demos remain a useful vocabulary even if the skill itself is not maintained."
    },
    {
      "id": "bencium-ux-designer",
      "name": "Bencium UX Designer",
      "section": "design",
      "kind": "plugin",
      "author": "bencium",
      "summary": "Two modes: Controlled (ship to prod: WCAG, full responsive specs, motion constraints) and Innovative (explore: bold, break rules). Ships ~830 lines of accessibility guidance and ~600 lines of responsive patterns as reference files Claude loads when needed.",
      "install": [
        "claude plugin marketplace add bencium/bencium-claude-code-design-skill",
        "claude plugin install bencium-controlled-ux-designer@bencium-marketplace"
      ],
      "requires": [],
      "source": "https://github.com/bencium/bencium-claude-code-design-skill",
      "docs": null,
      "stars": null,
      "tags": ["wcag", "responsive", "motion-spec", "design-system-template", "ux-persona"],
      "notes": "The marketplace is named bencium-marketplace and also carries bencium-innovative-ux-designer, design-audit and typography. Files: SKILL.md, ACCESSIBILITY.md, RESPONSIVE-DESIGN.md, MOTION-SPEC.md, DESIGN-SYSTEM-TEMPLATE.md."
    },
    {
      "id": "brand-guidelines",
      "name": "Brand Guidelines Skill",
      "section": "design",
      "kind": "skill",
      "author": "Anthropic",
      "summary": "Anthropic's own brand colors and typography as a skill. Not useful on its own, but a clean template for a brand skill for your company.",
      "install": [],
      "requires": [],
      "source": "https://claude.com/plugins",
      "docs": null,
      "stars": "Official",
      "tags": ["brand", "template", "typography", "colors"],
      "notes": "Copy the structure: a SKILL.md with the palette, type scale and voice rules, plus reference files for logos and assets."
    },

    {
      "id": "design-system-architect",
      "name": "Design System Architect",
      "section": "theming",
      "kind": "skill",
      "author": "community",
      "summary": "Builds a full token system from scratch: OKLCH color space (P3 wide gamut), 4px spacing grid, semantic light/dark theming, typography scale. Outputs a Tailwind v4 @theme block.",
      "install": [],
      "requires": [],
      "source": "https://mcp-market.vercel.app/tools/skills/design-system-architect-5",
      "docs": null,
      "stars": null,
      "tags": ["tokens", "oklch", "tailwind-v4", "dark-mode", "spacing-grid"],
      "notes": "Manual install: copy the skill folder into ~/.claude/skills/. Generates semantic color mapping, brand-tinted neutrals, typography scale, spacing grid and dark-mode tokens that become Tailwind utilities automatically."
    },
    {
      "id": "design-tokens",
      "name": "Design Tokens Skill",
      "section": "theming",
      "kind": "skill",
      "author": "phrazzld",
      "summary": "Builds the entire color system off a single --brand-hue variable in OKLCH. Change one number and everything re-themes: primary, backgrounds, borders, muted states.",
      "install": [],
      "requires": [],
      "source": "https://claude-plugins.dev/skills/@phrazzld/claude-config/design-tokens",
      "docs": null,
      "stars": null,
      "tags": ["tokens", "oklch", "brand-hue", "tailwind-v4"],
      "notes": "The site-theming skill in this plugin reproduces the approach so it works without installing anything."
    },
    {
      "id": "tailwind-css-kit",
      "name": "Tailwind CSS Kit",
      "section": "theming",
      "kind": "skill",
      "author": "blencorp",
      "summary": "Auto-activating Tailwind v4 skill: CSS-first @theme (no tailwind.config.js), dark-mode patterns, responsive utilities, component extraction, plugin setup (forms, typography).",
      "install": [],
      "requires": [],
      "source": "https://github.com/blencorp/claude-code-kit/blob/main/cli/kits/tailwindcss/skills/tailwindcss/SKILL.md",
      "docs": null,
      "stars": null,
      "tags": ["tailwind", "tailwind-v4", "dark-mode", "responsive"],